{
    "reviewer": "Reviewer name",
    "reviewedAt": "2026-03-08",
    "summary": "Fill in after the pilot run is reviewed.",
    "scenarios": {
        "theme-preference": {
            "persistenceAppropriateness": 5,
            "semanticNuanceCorrectness": 5,
            "unnecessaryUserIntervention": 5,
            "criticalSemanticMiss": false,
            "notes": "Replace with real notes."
        }
    }
}
